{
  "meta": {
    "last_updated": "2026-03-07",
    "base_currency": "TWD"
  },
  "cash": {
    "total_twd": 331015,
    "breakdown": {
      "中信（日常生活備用）": 8396,
      "玉山（投資扣款專用）": 45102,
      "永豐（投資扣款專用）": 183309,
      "Firstrade（美股帳戶，含CRWD持倉）": 94208
    },
    "note": "高現金比例保留市場大幅回調時的彈藥，購車計畫已暫取消，資金可更積極運用"
  },
  "long_term": {
    "positions": [
      {
        "ticker": "006208",
        "name": "富邦台50",
        "type": "equity_etf",
        "market": "TW",
        "cost_twd": 5839,
        "shares": 52,
        "sector": "台灣大盤指數",
        "theme": "台股核心配置",
        "dca_monthly": false,
        "broker": "玉山證券",
        "note": "長期定期定額核心部位；損益平衡價 112.57 TWD（均價 112.25 + 手續費）"
      },
      {
        "ticker": "00679B",
        "name": "元大美債1-3",
        "type": "bond_etf",
        "market": "TW",
        "cost_twd": 23611,
        "shares": 758,
        "sector": "短期美國公債",
        "theme": "防禦性部位",
        "dca_monthly": true,
        "dca_amount_twd": 2500,
        "broker": "玉山證券",
        "note": "月定額扣款，防禦部位核心；均價 31.14 TWD"
      },
      {
        "ticker": "00864B",
        "name": "群益0-1年美債",
        "type": "bond_etf",
        "market": "TW",
        "cost_twd": 15748,
        "shares": 379,
        "sector": "超短期美國公債",
        "theme": "防禦性部位/類現金",
        "dca_monthly": true,
        "dca_amount_twd": 2500,
        "broker": "玉山證券",
        "note": "月定額扣款，近現金特性；均價 41.54 TWD"
      },
      {
        "ticker": "VTI",
        "name": "Vanguard Total Stock Market ETF",
        "type": "equity_etf",
        "market": "US",
        "cost_twd": 39000,
        "shares": 4.12911,
        "sector": "美國全市場股票",
        "theme": "核心長期持倉",
        "dca_monthly": true,
        "dca_amount_twd": 2500,
        "broker": "永豐大戶投",
        "note": "美股核心配置，長期定期定額；均價約 295 USD（依成本反推，匯率估算 32）"
      },
      {
        "ticker": "VT",
        "name": "Vanguard Total World Stock ETF",
        "type": "equity_etf",
        "market": "US",
        "cost_twd": 15000,
        "shares": 3.41164,
        "sector": "全球股票",
        "theme": "全球市場分散",
        "dca_monthly": true,
        "dca_amount_twd": 2500,
        "broker": "永豐大戶投",
        "note": "全球分散配置，與VTI有部分重疊；均價約 137 USD（依成本反推，匯率估算 32）"
      },
      {
        "ticker": "VGIT",
        "name": "Vanguard Intermediate-Term Treasury ETF",
        "type": "bond_etf",
        "market": "US",
        "cost_twd": 15000,
        "shares": 8.01501,
        "sector": "中期美國公債",
        "theme": "防禦性部位",
        "dca_monthly": true,
        "dca_amount_twd": 2500,
        "broker": "永豐大戶投",
        "note": "月定額扣款，美股帳戶防禦配置；均價約 58.5 USD（依成本反推，匯率估算 32）"
      }
    ]
  },
  "tactical": {
    "positions": [
      {
        "ticker": "MRVL",
        "name": "Marvell Technology Inc.",
        "type": "stock",
        "market": "US",
        "cost_twd": 32000,
        "shares": 10.83658,
        "sector": "半導體（自訂 AI 晶片／資料中心網路／光學）",
        "theme": "AI ASIC 週期最直接受益者——Hyperscaler 定制推論晶片",
        "position_size": "custom",
        "position_pct": 0.1,
        "status": "Q4財報跳空突破後 Path A 進場，首批 $1,000 試探倉位",
        "strategy": "Path A 突破進場；後續等回測 $85–$88 再評估加碼；停損參考 $65（技術破位）",
        "catalysts": [
          "FY2026 Q4 EPS $0.80 超預期，資料中心營收 YoY +78%",
          "FY2027 營收指引接近 $11B（YoY +30%），Design Win 管線創歷史新高",
          "Google TPU v6/v7、Amazon Trainium 3/4 量產進入設計管線",
          "Forward P/E ~20x vs Broadcom 25–28x，仍有估值重估空間"
        ],
        "fundamentals": {
          "forward_pe": 19.6,
          "forward_eps_fy2027": 4.72,
          "analyst_target_usd": 114.06,
          "analyst_count": 39
        },
        "broker": "Firstrade",
        "note": "均價 92.28 USD（10.83658 股）；原始成本 1,000 USD；cost_twd 依匯率估算 32 換算約 32,000 TWD"
      },
      {
        "ticker": "CRWD",
        "name": "CrowdStrike Holdings",
        "type": "stock",
        "market": "US",
        "cost_twd": 6349,
        "shares": 0.5,
        "sector": "資安軟體",
        "theme": "AI時代企業資安平台整合",
        "position_size": "custom",
        "position_pct": 0.05,
        "status": "試探性倉位，Q4財報確認 ARR $5B+ 後進場",
        "strategy": "財報超預期（ARR 突破 $5B，年增 >23%），以試探 0.5 股建立基礎倉位；後續視技術面穩固決定是否加碼",
        "catalysts": [
          "Q4 財報 ARR 突破 $5B，年增超過 23%",
          "CEO 稱「有史以來最佳年度（best year yet）」，指引未下修",
          "地緣政治升溫持續強化企業資安預算"
        ],
        "broker": "Firstrade",
        "note": "均價 396.80 USD（0.5 股 × 396.80）；原始成本 198.40 USD；cost_twd 依匯率估算 32 換算約 6,349 TWD"
      },
      {
        "ticker": "ALAB",
        "name": "Astera Labs Inc.",
        "type": "stock",
        "market": "US",
        "cost_twd": 5923,
        "shares": 1.5,
        "sector": "半導體連接方案",
        "theme": "AI資料中心機架規模連接晶片",
        "position_size": "custom",
        "position_pct": 0.05,
        "status": "試探性倉位，等待 $175 突破或 Q1 財報毛利率確認後評估加碼",
        "strategy": "以試探倉位建立基礎部位；後續等技術面 $175 帶量突破或 2026-05-12 Q1 財報毛利率企穩後評估加碼",
        "catalysts": [
          "Scorpio PCIe 6 全球唯一量產地位，AI 資料中心機架規模架構受益",
          "Amazon 4.66 億 USD 認股權背書，供應鏈深度整合",
          "Morgan Stanley TMT Conference 管理層正面表態 Scorpio 出貨加速"
        ],
        "broker": "Firstrade",
        "note": "均價 123.39333 USD（1.5 股 × 123.39333）；原始成本 185.09 USD；cost_twd 依匯率估算 32 換算約 5,923 TWD"
      },
      {
        "ticker": "3030",
        "name": "德律科技",
        "type": "stock",
        "market": "TW",
        "cost_twd": 41550,
        "shares": 200,
        "sector": "半導體設備／AOI檢測",
        "theme": "AI先進封裝設備",
        "position_size": "full",
        "resistance_key": 217,
        "support_ref": 200,
        "status": "已加倉至滿倉，均價 207.75 TWD",
        "strategy": "持滿倉觀察突破 217 元前高；若突破確認則考慮續抱；跌破 200 元重要支撐再評估減碼",
        "broker": "玉山證券",
        "note": "合計均價 207.75 TWD / 合計損益平衡 208.97 TWD（含手續費）"
      }
    ]
  },
  "crypto": {
    "positions": [
      {
        "ticker": "USDT",
        "name": "Tether USD",
        "exchange": "Bitget",
        "type": "stablecoin",
        "cost_twd": 48595,
        "quantity": 1519,
        "role": "合約保證金／現貨買入資金",
        "note": "1,519 USDT；cost_twd 依匯率估算 32 換算"
      },
      {
        "ticker": "USDT",
        "name": "Tether USD",
        "exchange": "Bitunix",
        "type": "contract",
        "cost_twd": 36818,
        "quantity": 1150,
        "role": "短線合約交易",
        "note": "1,150 USDT；合約學習帳戶，操作策略為短線數小時內收倉；cost_twd 依匯率估算 32 換算"
      },
      {
        "ticker": "BTC",
        "name": "Bitcoin",
        "exchange": "Bitget",
        "type": "spot",
        "cost_twd": 21420,
        "quantity": 0.006537,
        "note": "現貨長期持有；cost_twd 2026-03-05 更新"
      },
      {
        "ticker": "ETH",
        "name": "Ethereum",
        "exchange": "Bitget",
        "type": "spot",
        "cost_twd": 6434,
        "quantity": 0.1547,
        "note": "現貨長期持有；cost_twd 2026-03-05 更新"
      },
      {
        "ticker": "XRP",
        "name": "XRP",
        "exchange": "Bitget",
        "type": "spot",
        "cost_twd": 5285,
        "quantity": 60.57,
        "note": "現貨長期持有；cost_twd 2026-03-05 更新"
      }
    ]
  },
  "watchlist": [
    {
      "ticker": "NET",
      "name": "Cloudflare Inc.",
      "exchange": "NYSE",
      "market": "US",
      "sector": "網路基礎建設／資安",
      "theme": "AI流量成長、Zero Trust、CDN",
      "priority": 2,
      "entry_condition": "技術面底部確認，情緒面由bearish轉neutral；等帶量止跌K棒",
      "key_metrics": {
        "52w_high_usd": 175,
        "decline_from_high": -0.34
      },
      "next_event": "等技術面帶量止跌確認後評估進場"
    }
  ],
  "strategy": {
    "investment_horizon": "6個月（2026下半年集中部署）",
    "overall_theme": "AI基礎建設全鏈路佈局",
    "key_upcoming_events": [
      {
        "date": "2026-03-03",
        "ticker": "CRWD",
        "event": "Q4財報"
      },
      {
        "date": "2026-03-03",
        "ticker": "ALAB",
        "event": "Morgan Stanley TMT Conference"
      },
      {
        "date": "2026-05-12",
        "ticker": "ALAB",
        "event": "Q1財報"
      }
    ],
    "risk_notes": [
      "軟體股IGV ETF今年已跌23%，情緒底部未確認",
      "AI取代SaaS敘事仍存在，任何AI新工具發布都可能觸發殺盤",
      "德律217元前高壓力是關鍵觀察點",
      "合約帳戶僅做短線數小時內，不做隔夜部位"
    ]
  }
}